[
  {
    "id": "comment-001",
    "clientId": "client-001",
    "caseId": "case-001",
    "authorSubjectType": "client",
    "authorId": "contact-001",
    "authorName": "Иван Петров",
    "visibility": "client",
    "body": "Прошу включить в выписку также информацию о корпоративных действиях и начисленных дивидендах.",
    "isSystemGenerated": false,
    "createdAt": "2026-02-03T10:35:00Z"
  },
  {
    "id": "comment-002",
    "clientId": "client-001",
    "caseId": "case-001",
    "authorSubjectType": "user",
    "authorId": "user-001",
    "authorName": "Мария Сидорова",
    "authorRole": "RM",
    "visibility": "client",
    "body": "Добрый день, Иван! Обязательно включим всю запрошенную информацию. Выписка будет готова в течение 2 рабочих дней.",
    "isSystemGenerated": false,
    "createdAt": "2026-02-03T11:00:00Z"
  },
  {
    "id": "comment-003",
    "clientId": "client-001",
    "caseId": "case-001",
    "authorSubjectType": "system",
    "authorId": "system",
    "authorName": "System",
    "visibility": "internal",
    "body": "Статус изменен: open",
    "isSystemGenerated": true,
    "actionType": "status_change",
    "actionMetadataJson": "{\"from\":null,\"to\":\"open\"}",
    "createdAt": "2026-02-03T10:30:00Z"
  },
  {
    "id": "comment-004",
    "clientId": "client-001",
    "caseId": "case-002",
    "authorSubjectType": "system",
    "authorId": "system",
    "authorName": "Data Quality Monitor",
    "visibility": "internal",
    "body": "Автоматически создан инцидент из Data Quality Exception #dq-exception-123",
    "isSystemGenerated": true,
    "actionType": "status_change",
    "createdAt": "2026-02-03T11:00:00Z"
  },
  {
    "id": "comment-005",
    "clientId": "client-001",
    "caseId": "case-002",
    "authorSubjectType": "user",
    "authorId": "user-002",
    "authorName": "Алексей Козлов",
    "authorRole": "Data Operations",
    "visibility": "internal",
    "body": "Начал расследование. Расхождение вызвано задержкой обработки корпоративного действия (stock split) со стороны брокера.",
    "isSystemGenerated": false,
    "createdAt": "2026-02-03T12:30:00Z"
  },
  {
    "id": "comment-006",
    "clientId": "client-001",
    "caseId": "case-003",
    "authorSubjectType": "user",
    "authorId": "user-004",
    "authorName": "Дмитрий Орлов",
    "authorRole": "Compliance",
    "visibility": "internal",
    "body": "Запрос передан на рассмотрение инвестиционному комитету. Заседание запланировано на 08.02.2026.",
    "isSystemGenerated": false,
    "createdAt": "2026-02-02T10:00:00Z"
  },
  {
    "id": "comment-007",
    "clientId": "client-001",
    "caseId": "case-003",
    "authorSubjectType": "user",
    "authorId": "user-004",
    "authorName": "Дмитрий Орлов",
    "authorRole": "Compliance",
    "visibility": "client",
    "body": "Уважаемый клиент, ваш запрос на изменение инвестиционной политики передан на рассмотрение инвестиционному комитету. Мы свяжемся с вами после принятия решения.",
    "isSystemGenerated": false,
    "createdAt": "2026-02-02T10:05:00Z"
  },
  {
    "id": "comment-008",
    "clientId": "client-001",
    "caseId": "case-004",
    "authorSubjectType": "system",
    "authorId": "system",
    "authorName": "SLA Monitor",
    "visibility": "internal",
    "body": "SLA Response Time Breach! Время первого ответа превысило допустимый лимит.",
    "isSystemGenerated": true,
    "actionType": "sla_breach",
    "actionMetadataJson": "{\"breachType\":\"response\",\"overdueMins\":30}",
    "createdAt": "2026-02-03T12:30:00Z"
  },
  {
    "id": "comment-009",
    "clientId": "client-001",
    "caseId": "case-004",
    "authorSubjectType": "system",
    "authorId": "system",
    "authorName": "Escalation Engine",
    "visibility": "internal",
    "body": "Эскалация уровня 1: уведомлен Team Lead Data Operations",
    "isSystemGenerated": true,
    "actionType": "escalation",
    "actionMetadataJson": "{\"level\":1,\"notified\":[\"Team Lead Data Operations\"]}",
    "createdAt": "2026-02-03T12:30:00Z"
  },
  {
    "id": "comment-010",
    "clientId": "client-001",
    "caseId": "case-004",
    "authorSubjectType": "user",
    "authorId": "user-005",
    "authorName": "Сергей Николаев",
    "authorRole": "Engineering",
    "visibility": "internal",
    "body": "Проблема локализована. Обнаружен race condition при параллельной обработке транзакций. Готовлю hotfix.",
    "isSystemGenerated": false,
    "createdAt": "2026-02-03T13:00:00Z"
  },
  {
    "id": "comment-011",
    "clientId": "client-002",
    "caseId": "case-005",
    "authorSubjectType": "client",
    "authorId": "contact-002",
    "authorName": "Анна Михайлова",
    "visibility": "client",
    "body": "Документы нужны для подготовки налоговой декларации. Срок подачи - 15 февраля.",
    "isSystemGenerated": false,
    "createdAt": "2026-02-03T08:05:00Z"
  },
  {
    "id": "comment-012",
    "clientId": "client-001",
    "caseId": "case-006",
    "authorSubjectType": "user",
    "authorId": "user-006",
    "authorName": "Ольга Кузнецова",
    "authorRole": "Finance",
    "visibility": "internal",
    "body": "Проверила расчет. Действительно, в расчете комиссии была применена неверная ставка для одного из портфелей.",
    "isSystemGenerated": false,
    "createdAt": "2026-02-03T10:00:00Z"
  },
  {
    "id": "comment-013",
    "clientId": "client-001",
    "caseId": "case-006",
    "authorSubjectType": "user",
    "authorId": "user-006",
    "authorName": "Ольга Кузнецова",
    "authorRole": "Finance",
    "visibility": "client",
    "body": "Уважаемый Иван, мы подтверждаем расхождение в сумме 1,250 USD. Подготовим корректирующий документ и возврат средств.",
    "isSystemGenerated": false,
    "createdAt": "2026-02-03T10:15:00Z"
  }
]
